,origReview,origSummary,predSummary
0,just like you and me but her efforts have backfired after internet trolls stole the family snaps of heidi now from the site and published them on mocking facebook pages one of the pages was illustrated with pictures of heidi as toddler and joked about losing your virginity to retard web taunts heidi crowter who was taunted online is pictured here with her mother liz heidi is holding her laptop which shows picture of her with an offensive remark another was called your milkshake body brings all the to the yard twisted reference to popular song mrs crowter who has three other children said it makes me sad and angry that people don see it as wrong to be so hurtful they simply cannot have had the pleasure of meeting anyone with down otherwise they would realise they are warm human beings like anyone else she added there have been other cases of trolls ending up in court and like to see these trolls face the same punishment if possible targeted by heidi crowter who was mocked after images were stolen from the coventry and rugby down syndrome support group website the images had been stolen from the coventry and rugby down syndrome support group website which mrs crowter ran for five years until web taunts mrs crowter complained to police about the vile taunts but they weren interested in investigating she and her husband steve discovered the first mocking page online last september and it has since been taken down but earlier this month the couple who run car dealership became aware of the milkshake page and third also on facebook feel violated and violated on heidi behalf it not just heidi it photos of other people children as well mrs crowter added despite repeatedly reporting the trolls the couple say facebook has made no direct contact with them although heidi picture has now been removed from the second page the third remains online and contains at least images of her mrs crowter from coventry said she had contacted west midlands police but said she was told that it was not matter for officers down syndrome is genetic condition caused by an extra chromosome in baby cells in the uk around one baby in every is born with it mrs crowter said heidi was very independent young lady who was studying for her gcses at mainstream school and doing hairdressing course facebook said that once images were reported they were reviewed by its user operations team spokesman said when people on facebook do find themselves in situation where they feel uncomfortable we encourage them to use our reporting tools west midlands police confirmed it had received complaint but said this was withdrawn after the photograph was removed from facebook officers had visited the complainant to reassure her and ensure no offences had been committed spokesman said highlight liz crowter posted pictures of daughter heidi on down syndrome support group website highlight mother contacted police but no investigation was launched ,liz posted pictures of daughter heidi on down syndrome support group website highlight mother contacted police but no investigation was launched , the year old has been in the of the year highlight the year old was found to the year of the year old highlight the year old was found to the of the year of the year highlight the year old has been in the of the year of the year
1,pictured puffing away on cigarette then she slaps on bangles heavy black eyeliner and headscarf to turn into michelle designer rick owens mysterious muse and wife baddie whose real name is helen ruth van winkle became an internet sensation last year after posting age defying photos online the great grandmother from kentucky now has more than followers her instagram updates usually include snaps of her smoking or performing other bad gal antics purring baddie strikes pose identifying as legendary musician kurt cobain impression the octogenarian also posed for another shot as michele the wife muse and creative mind behind fashion designer rick owens on my way to steal your man baddie became an internet sensation after she started up her controversial instagram account in april last year while no doubt eager to on baddie impressive online profile the agency which commissioned the unique shoot also added that it was her no nonsense attitude and air of confidence that really made the grandmother stand out as an ideal spokesperson and model true firecracker baddie first caught out eye on instagram where the posts pictures of herself wearing tie dye bathing suits and while telling off all the haters spokesperson explained with thousands of followers and fans among the likes of drake rihanna and miley cyrus baddie is an inspiration and proof that energy hustle and general ness don disappear with age baddie who also shares great deal of video content via her instagram account has even been spotted wearing clothing with the slogan stealing your man since scrawled across it demonstrating to the world that she isn afraid what they think about her peace out baddie who has her own website says she enjoys her over the top persona and helping others poolside the great grandmother regularly posts shots of her in swimwear tie dye some of her clothes have controversial slogans on them although this one just about chipotle earlier this year she told dailymail com that her goals in were to continue to decide to be happy eat more chocolate try more new things and do cool reality series on how to be baddie the latest set of pictures shows baddie certainly means business have something to look forward to each day and it helps to inspire others young and old get to make others laugh and not take life so seriously she added to dailymail com am absolutely amazed about the amount of publicity have received from my postings am blown away but love it and each day look to see how many more followers have received it great feeling knowing impacting others lives but in reality the love and sweet words make my life much better it really helps me more than am helping others highlight baddie winkle from kentucky appears in new campaign for brooklyn based creative agency highlight she is known for posting risque snaps on instagram including images of her smoking and posing in swimwear highlight the year old now has more than followers ,from kentucky appears in new campaign for brooklyn based creative agency highlight she is known for posting snaps on instagram including images of her smoking and posing in highlight the year old now has more than followers , the year old has been in the of the year highlight the year old was found to the year of the year old highlight the year old was found to the of the year of the year highlight the year old has been in the of the year of the year
2,developed on an industrial scale for cattle and don like the feeling of having been bred but meeting the half siblings that have tracked down has been very life enriching experience this does make it frustrating too because know there are all those other siblings out there who don know but would really like to meet love to be able to hire huge marquee and invite them all to party wiesner and barton clinic based in london portland place is believed to have helped women conceive around babies known as the barton brood trent hit the headlines last december after revealing he had fathered children despite being virgin by donating his sperm to challenged couples mr from silicon valley california set up free online sperm bank to help childless couples in situations where he claimed the only other alternative would be sex with stranger speaking on anderson cooper daytime show he said per cent of my sexual energy is for producing sperm for childless couples to have babies so don have other activity outside of that will probably be the year old virgin except ll have plus kids he told huffington post helping people in need not running business here the high fees meant most of their clients were middle class but barton also claimed to have helped many of the upper classes and even some peers of the realm the couple used family friends to provide sperm but shortage of donors is believed to have led to wiesner providing the majority dna tests were carried out in on people conceived at the clinic between and the tests found that of the group two thirds were wiesner children dr barton told government forum on artificial insemination matched race colouring and stature and all donors were drawn from intelligent stock she added wouldn take donor unless he was if anything little above average if you are going to do it create child deliberately you have got to put the standards rather higher than normal an article the couple wrote in about their work prompted peer to denounce their activities in the house of lords as the work of geoffrey fisher then archbishop of canterbury also demanded the closure of the clinic austrian born wiesner died in aged his wife died years ago mr gollancz was involved in campaign to stop sperm donors being anonymous but said he still wanted further changes in the law he said would like to see birth certificates also carrying the name of the sperm or egg donor most recipient parents don tell their children they are conceived this way meaning they would never know to search for donor father people have right to know about their own history highlight bertold wiesner set up the controversial london barton clinic with his wife mary in the highlight only select members of the couple friends were chosen as donors to help women conceive babies highlight two biological sons have found others conceived at clinic were fathered by dr wiesner ,set up the controversial london barton clinic with his wife mary in the highlight only select members of the couple friends were chosen as donors to help women conceive babies highlight two biological sons have found others conceived at clinic were by dr , the year old has been in the of the year highlight the year old was found to the year of the year old highlight the year old was found to the of the year of the year highlight the year old has been in the of the year of the year
3,up the wire brake cable taken from vandalised child bicycle had been tied about three feet off the floor and stretched for eight feet between park bench and railings in titchfield common hampshire bradley deacon from leigh park with his daughter lilly who was injured when she was cut by sharp wire when out on her bike lilly went off on her bike laughing and giggling but as she turned around corner could suddenly hear tears thought oh god she come off her bike but no to our horror it was even worse she had ridden into brake cable that had been stretched across the path deliberately in my view with the intention to hurt someone she got back up off the floor but was in lot of pain and there now mark around her neck lilly grandfather colin deacon at the spot where the wire was stretched across the path in hampshire the thin wire can be seen in this picture police would like to speak to two teenage boys who were in the park know youngsters like to play pranks but stringing up wire cable you can see is disgusting and dangerous lilly loves her bike and this was terrible thing to do that could ruin little girl summer holiday and put her off cycling after tending to lilly mr deacon snr from titchfield common set about warning others using the path he helped police remove the wire which was about three feet off the floor and stretched for eight feet now he is urging the two teenagers he spoke to sitting near the scene to come forward to help police catch whoever strung the wire up he said we need anyone with any information to come forward so we can bring the culprits to justice this was not prank it was serious attempt to hurt someone for fun and that unacceptable hampshire police are appealing for information about the incident which took place between pm and pm on thursday pc jim heath wants to stop the dangerous situation happening again and echoed mr deacon plea he said very keen to trace those responsible to ensure there is no repeat incident and make them aware of how dangerous this could ve been police want to speak to anyone in the park who may have seen someone fixing the cable in place or tampering with the abandoned child bmx they also believe two boys aged around or sitting in the play park at the time may hold vital information and urged them to come forward highlight lilly bailey deacon nearly decapitated by wire strung across footpath highlight she was thrown from her bike when she rode into the sharp wire highlight it was tied about three feet off the floor in titchfield common hampshire highlight she was left badly shaken with bruising around her neck highlight hampshire police is appealing for help to trace those responsible highlight two teenage boys seen in the play park may hold vital information ,bailey nearly by wire across highlight she was thrown from her bike when she rode into the sharp wire highlight it was tied about three feet off the floor in common hampshire highlight she was left badly with bruising around her neck highlight hampshire police is appealing for help to trace those responsible highlight two teenage boys seen in the play park may hold vital information , the year old has been in the of the year highlight the year old was found to the year of the year old highlight the year old was found to the of the year of the year highlight the year old has been in the of the year of the year
4,chant in groups which repeats hare krishna hare krishna over and over the four central principles of the movement are no eating of meat no illicit sex no gambling and no intoxication of alcohol caffeine tobacco or other recreational drugs the tv star is said to be terrified about losing her son to the organization the hare krishna movement previously has been accused of brainwashing in lawsuit for false imprisonment among other claims sophomore student nikko reportedly met mr akinsanya who is freshman at the same university last year after wheel of fortune star vanna and her ex husband and nikko father george santo pietro refused to give the money the enquirer claims that the monk has been trying to cut his teenage housemate off from his family advising that nikko follow his own path mr pietro is former restaurateur who is believed to be worth in excess of million the couple married in december and divorced in november showbiz friend of ms white told the enquirer this man is clearly targeting nikko for his family money akinsanya who is originally from the war torn west african nation of liberia often appears on the college campus in his tradition yellow hare krishna robe to encourage students to visit his meditation center akinsanya first lived in new jersey when he arrived in the before moving to seattle where the enquirer claims he faced money problems in fame and fortune vanna with her son nicholas and daughter giovanna in as her star is laid on the hollywood walk of fame firm friends nikko met the year old monk last year after the students met at the university of arizona assuming control vanna white is said to be deeply concerned that her son is living with year old hare krishna monk named jaycee akinsanya he was allegedly evicted in king county washington after failing to pay rent and legal fees of around nikko told the enquirer that he did not ask his parents for million to build an ashram he added the money asked for was for my living expenses food gas and for living my spiritual life with jaycee nikko facebook page is filled with pictures of the pair visiting hare krishna temple and taking road trip to canada it is also claimed by the enquirer that jaycee is taking break from his monk duties and converted his ashram traditionally group spiritual hermitage into private home for himself and nikko breaking free ms white teenage son denied that he had asked his parents for money but said he needed cash to cover his spiritual live with jaycee wealthy upbringing vanna white who is worth an estimated million with her son in ms white with her son father george santo pietro whom she divorced in right highlight ms white son nicholas lives with hare krishna monk in arizona highlight tv star worth an estimated was asked for by her son which he categorically denies highlight monk jaycee akinsanya was once evicted for owing ,ms white son nicholas lives with monk in arizona highlight tv star worth an estimated was asked for by her son which he denies highlight monk was once evicted for , the year old has been in the of the year highlight the year old was found to the year of the year old highlight the year old was found to the of the year of the year highlight the year old has been in the of the year of the year
5,souvenir hat is one of the items going under the hammer at an auction in california the one of kind vintage collection includes red banner featuring an image of mickey mouse bidders will have chance to buy pirates of the caribbean skeleton and popcorn box this disneyland bade is one of nearly collectibles that are being auctioned by van eaton galleries it is believed the rare collection will fetch tens of thousands of pounds when it is sold off piece by piece at van eaton galleries in sherman oaks california this weekend the assortment of souvenirs games toys and collectibles from the famous theme park in anaheim offers look at walt disney empire through the ages some of the items date back to the very beginning of walt disney planning for his first resort and the one of kind collection has been amassed over years those looking to own piece of disney history can bid on the original audio animatronic skeleton from the pirates of the caribbean an original bob bushman concept drawing for and an original cigar store indian from one of the rarer items disneyland blueprint is expected to sell for up to some of the more unique items include colourful uniforms worn by front line staff and entertainers it is believed the rare collection will fetch tens of thousands of pounds when it is sold off piece by piece mr bushman concept drawing is hotly tipped to do well with it expected to sell for up to high bids are also expected on tiki bird from the enchanted tiki room valued at to or to and michael jackson artwork from the captain attraction estimated at to or to some of the more affordable items include popcorn box valued at to or to and cigar box featuring sleeping beauty castle estimated at to or to nearly souvenirs from lot titled the story of disneyland are set to go under the hammer this old souvenir promoted acres of fun at including its sleeping beauty castle some of the rare pieces of memorabilia were initially collected by roy disney the brother of walt disney high bids are expected on tiki bird from the tiki room and an original cigar store indian some of the rare pieces of memorabilia were initially collected by roy disney the brother of walt disney mike van eaton founder and president of van eaton galleries said in statement the collection is beyond extraordinary the breadth of this vintage collection offers every collector an opportunity to bid and own piece of disneyland history it tells story of disneyland from the beginning which we have never seen before and sure we won ever see again highlight nearly items included in the story of disneyland collection highlight set includes donald duck hat disneyland blueprint and staff uniforms highlight it is billed as the most comprehensive and complete collection highlight blueprint is expected to fetch top bid of nearly highlight other items include skeleton from the pirates of the caribbean ,nearly items included in the story of collection highlight set includes donald duck hat and staff uniforms highlight it is as the most and complete collection highlight is expected to fetch top bid of nearly highlight other items include from the of the caribbean , the year old has been in the of the year highlight the year old was found to the year of the year old highlight the year old was found to the of the year of the year highlight the year old has been in the of the year of the year
6,by jennifer newton highway department worker who rescued his girlfriend cat which was stuck up tree has been sacked after using his town bucket truck to save the pet jim mackie the highway superintendent of phillipston massachusetts went to the aid of jackie prime whose ginger cat kaboodle was stranded at the top of tree in her backyard in nearby westminster in may ms prime had called the town fire department and several tree companies but they were unable to help free kaboodle jim mackie who has lost his job as highway department worker after using his bucket truck to rescue his girlfriend cat at last resort she called mr mackie who used town of phillipston fire truck to bring down the cat who scampered up the tree during storm but during the rescue the truck became stuck in the muddy garden and mr mackie summoned another highway worker in dump truck to free the vehicle complaint was then filed against mr mackie for using phillipston town equipment in westminster on non official business he was suspended on two week pay and was effectively fired after the board of chose not to re appoint him as highway superintendent the cat called kaboodle became stuck at the top of tree after bolting from the house after being scared by storm mr mackie told cbs boston was just trying to help her out period nothing more nothing less would have done the same thing for any phillipston employee ms prime says she only called her friend after becoming exasperated after nobody would help rescue her pet and can believe it cost him his job she added reached out to friend never thought it would cost him his job mr mackie girlfriend jackie prime pictured who said she only asked for his help to rescue the cat after the town fire department couldn help just can believe they would derail man life over something like this if this is just about cat then the punishment doesn fit the crime mr mackie has now consulted lawyer after losing his job which he says he wants to get back the board of refused to comment on the case highlight jim mackie went to aid of jackie prime whose cat was stuck up tree highlight the cat kaboodle had ran out of her house in massachusetts during storm highlight superintendent took phillipston bucket truck to house in westminster highlight complaint filed for using equipment outside town on non official business highlight has now lost his job after board of decided not to re appoint him ,jim went to aid of jackie prime whose cat was stuck up tree highlight the cat had ran out of her house in massachusetts during storm highlight took bucket truck to house in westminster highlight complaint filed for using equipment outside town on non official business highlight has now lost his job after board of decided not to re appoint him , the year old has been in the of the year highlight the year old was found to the year of the year old highlight the year old was found to the of the year of the year highlight the year old has been in the of the year of the year
