,origReview,origSummary,predSummary
14,when leno was temporarily moved to prime time few years ago brien held onto the job for just eight months before being replaced by his predecessor brien now hosts show on cable network leno whose contract expires next year hasn always sounded so gracious over fallon taking over he has recently used comedy as weapon against his network bosses branding recent ratings boost miracle and saying that nbc is big number two in his show hit with youth jimmy fallon has proved remarkably popular and executives believe his age and appeal to younger viewers will keep tonight on top for years to come you know what that means between easter and passover this is truly the season of miracles we re number two ve been saying for the last week that nbc is big number two haven been saying that congratulations leno went on to talk about report that mobile is reducing its contracts adding apparently they got the idea from nbc the routine comes hot on the heels of other cutting remarks against executives at the network leno had also joked about make nice meeting he had with bosses the night before he said to make amends they had offered to send him and his wife on carnival cruise the crippled liner that caused passengers to endure five nightmarish days in the gulf of mexico in another leno cited news reports of canadian man who had knife pulled from his back after three years he sniped he must have worked at nbc too rising star jimmy fallon is photographed with snl creator producer lorne michaels fallon will be leno replacement on tonight which will be executive produced by michaels in another routine he referred to his bosses as snakes you know the whole legend of st patrick right st patrick drove all the snakes out of ireland and then they came to the united states and became nbc executives the rapid ascent of fallon and his certain promotion is seen by analysts as nbc recognizing the competition offered by abc popular jimmy kimmel while leno tonight show still tops the ratings kimmel moved his show to the earlier time slot of pm to directly compete with him and cbs david letterman the times report quoted one senior executive as saying there is no way on earth that this is not going to happen certainty which may explain why leno isn holding back the abuse according to several reports scientists say they are getting closer and closer to being able to do jurassic park style cloning of extinct species leno he told his audience one night imagine that things that were once thought to be extinct could be brought back from the dead so there hope for nbc it could turn around highlight the transition will take place following next year winter olympics highlight this time it feels right leno referred to ousting by conan brien highlight show will move from los angeles to new york where it originally started ,the transition will take place following next year winter olympics highlight this time it feels right referred to by brien highlight show will move from los angeles to new york where it originally started , the year old has been in the of the year highlight the year old was found to the year of the year old highlight the year old was found to the of the year of the year highlight the year old has been in the of the year of the year
15,with gifts inspired by royal artwork you might expect them to be fit for queen but it emerged yesterday that buckingham palace is selling royal themed gifts shipped in from overseas while some items are labelled as being made in england the royal collection trust shop sells teddy bears flown in from china and towels made in the eu this royal nursery teddy bear which is just one of large selection of good which are manufactured in china for sale in the palace shops the royal nursery teddy bear on sale for was one of large selection of goods made in china and which are sold at official outlets at buckingham palace windsor castle holyrood palace in edinburgh and online pair of children corgi slippers selling for are also manufactured in china while white towels with the buckingham palace insignia embroidered in gold stitching at for bath towel and for hand towel are made in the eu children shirt with guardsman logo from turkey is also offered for the trust website states that the gifts are inspired by objects and works of art in the royal collection and on display at official residences including buckingham palace windsor castle and the palace of white towels with the buckingham palace insignia embroidered on in gold stitching selling for for bath towel and for hand towel have labels stating they are made in the eu pair of children corgi slippers on sale in the shops and online for are manufactured over in china last night spokeswoman told the sun the royal collection trust endeavours to use uk suppliers wherever possible some items such as children soft toys are manufactured overseas in order to offer the most accessible price point for visitors to our shops between and the royal collection trust website had sales of with proceeds going towards the maintenance of the queen artwork the goods are sold at official outlets at buckingham palace windsor castle holyrood palace in edinburgh and online other popular children items on sale at the trust are the corgi with medallion and guardsman hat highlight buckingham palace is selling royal themed gifts shipped in from overseas highlight the royal collection trust shop sells teddy bears flown in from china highlight embroidered towels made in the eu and shirts from turkey also on sale ,buckingham palace is selling royal themed gifts shipped in from overseas highlight the royal collection trust shop sells teddy bears flown in from china highlight made in the eu and shirts from turkey also on sale , the year old has been in the of the year highlight the year old was found to the year of the year old highlight the year old was found to the of the year of the year highlight the year old has been in the of the year of the year
16,by ian ladyman follow ian_ladyman_dm and craig hope follow craighope picture of the day they might be tottenham team mates but lewis holtby and sandro were not the best of friends before tuesday night game brazilian sandro posted this picture on his instagram account squaring up to his german colleague friendly rival spurs team mates lewis holtby and sandro were on opposite sides for tuesday semi final familiar face robin van persie once fumed at turkish official calling him an unknown after the referee sent off his man utd team mate nani in champions league game no prizes for guessing who is in charge of tonight semi final between holland and argentina neymar may not have been in action against germany on tuesday night but brazilian paper offered fans cut out mask of his face to ensure the star would be there in spirit are you neymar in disguise fans wear masks in tribute to injured brazilian meanwhile napoli have come out in support of juan zuniga their colombian player whose knee in the back injured neymar the italians say there was no malice in the challenge italian job swap italy are open to former galatasaray boss roberto mancini replacing former italy boss cesare prandelli who is now at galatasaray coining it in it was one of the goals of the tournament and now coin commemorating robin van persie stunning diving header against spain has sold out six thousand of the limited edition souvenirs were snapped up in matter of hours by dutch fans argentina were celebrating on tuesday but it was not for world cup win instead their twitter account reached half million followers highlight holtby has last laugh as germans humiliate samba boys in belo horizonte highlight brazilian fans wear neymar masks in tribute to their crocked talisman highlight argentina celebrate after reaching followers on twitter ,has last laugh as germans boys in belo horizonte highlight brazilian fans wear neymar in tribute to their highlight argentina celebrate after reaching followers on twitter , the year old has been in the of the year highlight the year old was found to the year of the year old highlight the year old was found to the of the year of the year highlight the year old has been in the of the year of the year
17,city university of seattle or strayer university tuition for an online degree at asu is about year roughly the same for its traditional educational programs for the freshmen and sophomore years starbucks and arizona state say they will put around on average toward the estimated in total tuition to cover the remaining workers would apply for financial aid if worker qualified for full pell grant of year or over the two years he or she would theoretically be left with about to pay out of pocket so far starbucks has paid out million under that program said laurel harper company spokeswoman zee year old starbucks employee and union organizer in madison wisconsin said she thought the program might be useful to some workers but she noted that prospective employers also look at where degree was earned and that actual in class experience matters as with most matters involving financial aid the terms of the new program are somewhat complicated and will vary depending on each worker situation tuition for an online degree at asu is about year roughly the same for its traditional educational programs for the freshmen and sophomore years starbucks and arizona state say they will put around on average toward the estimated in total tuition to cover the remaining workers would apply for financial aid since starbucks workers don earn lot of money many would likely qualify for pell grant said mark kantrowitz publisher of com website about paying for college if worker qualified for full pell grant of year or over the two years he or she would theoretically be left with about to pay out of pocket the program would work similarly for the junior and senior years except that starbucks would reimburse any money workers end up having to pay out of pocket starbucks said most of its workers have already started school so could potentially finish off their degrees at no cost if they applied for the program the company says the program will be available to workers at its other chains as well including teavana tea shops and seattle best the program is available only to workers at starbucks company operated locations another locations are operated by kantrowitz said the new program at starbucks has the potential to benefit all parties involved workers will get chance to earn degree in relatively affordable way and starbucks could attract better pool of workers arizona state university will also have major employer potentially sending lots of students its way it way to expand revenue he said of the online programs offered by traditional brick and mortar universities enrollment for arizona state university online program already stands at around sorry we are not currently accepting comments on this article highlight workers can earn an online college degree at arizona state university highlight offered to employees who work at least hours week highlight program doesn require workers to stay at starbucks after they finish highlight pick from range of programs that aren related to their starbucks work ,workers can earn an online college degree at arizona state university highlight offered to employees who work at least hours week highlight program doesn require workers to stay at starbucks after they finish highlight pick from range of that aren related to their starbucks work , the year old has been in the of the year highlight the year old was found to the year of the year old highlight the year old was found to the of the year of the year highlight the year old has been in the of the year of the year
18,as the jury of eight men and four women unanimously found him guilty of murder after deliberating for nearly hours the former solider from fareham hampshire was also found guilty of three counts of rape one count of attempted rape and another serious sexual assault relating to three other women taylor who was at the time of the murder was described as reasonably good looking and strong man who had reputation as womaniser despite being married victim sally mcgrath left was brutally killed by paul taylor seen right around the time of the attack in the summer of in march he repeatedly raped year old after offering her lift home from the bull hotel in peterborough month later taylor attacked year old girl after offering her lift home from christening party near the town mr justice owen the jury heard that as he drove her back he pulled into layby and grabbed her by the back of the neck saying you know you want it when she resisted taylor punched her in the face then pushed her from his vehicle and drove off the court heard just two weeks before the disappearance of sally mcgrath the murderer who was then working as builder convinced year old girl to join him and teenage apprentice on boat ride but once she got into the van he drove her to stretch of woodland just yards from where he would later bury miss mcgrath and violently raped the teenager telling his workmate to come back in half an hour when the apprentice returned taylor was said to be back to his charming self and even offered to buy the pair an ice cream fortnight after the rape on the morning of july sally mcgrath said goodbye to her mother as she left her parents house it was the last time the year old was seen alive taylor had been subject to bail conditions for burglary but had failed to report to police station as instructed at pm on the night of miss mcgrath disappearance the court heard ahead of the verdict mr khalil qc prosecuting had described the murder of miss mcgrath as the culmination of the defendant predatory traits following number of violent sexual assaults on young woman he had urged jurors at the culmination of taylor eight week trial you may well wonder why these offences were not prosecuted or prosecuted more vigorously closer to the time but it is your task to ensure justice is done now this man has escaped justice for too long highlight paul taylor now was today jailed for life for brutally murdering sally mcgrath more than years ago highlight the fish and chip shop owner will serve minimum term of years chelmsford crown court heard highlight the mystery of miss mcgrath death in remained unsolved until taylor was charged following cold case review launched in highlight taylor was also convicted of string of sex attacks on other women in the months leading up to the murder ,paul taylor now was today jailed for life for brutally murdering sally mcgrath more than years ago highlight the fish and chip shop owner will serve minimum term of years crown court heard highlight the mystery of miss mcgrath death in remained unsolved until taylor was charged following cold case review launched in highlight taylor was also convicted of string of sex attacks on other women in the months leading up to the murder , the year old has been in the of the year highlight the year old was found to the year of the year old highlight the year old was found to the of the year of the year highlight the year old has been in the of the year of the year
19,months after the accident schumacher was recently transferred from the hospital in grenoble france to unit near his swiss home allowing his wife corinna to attend public event at her ranch in michael schumacher right with his wife corinna left were skiing in france in december when the major accident happened now his family fears that his confidential medical notes have been leaked to the media media in france and switzerland said that prosecutors in grenoble france are currently looking computer ip address which belongs to swiss helicopter firm who were consulted during the rescue prosecutors have not named the company publicly but they have been working with authorities in switzerland on the case medics in grenoble are believed to have contacted the company while discussing the possibility of flying the former formula champion to switzerland to continue his recovery the records which are believed to consist of several pages of medical notes outlining the extent of the injury suffered by schumacher last month schumacher manager sabine kehm that the documents had been clearly stolen warning that anyone buying or publishing the confidential files would be prosecuted it is understood that the notes were offered for sale across europe to media organisations for corinna schumacher left made her first public appearance in several months at her ranch in switzerland after her husband was transferred to clinic near their home to continue his recovery according to the bbc the new information was reported in french newspaper le initially it was believed that hospital worker or member of the ambulance team that transferred schumacher from france to switzerland may have been behind the theft the latest development emerged in french newspaper le and swiss media said it had been confirmed by the prosecutor in grenoble suspicions had initially fallen on the hospital in grenoble and the ambulance team which eventually drove him across the border according to the grenoble prosecutor the computer was traced back to helicopter company in the swiss canton of zurich the company name has not been made public the file had been sent to doctor at the company although there was nothing to link the doctor to the alleged offence it is thought the findings of the french inquiry will now be handed to the authorities in switzerland ms kehm said we cannot judge if these documents are authentic however the documents are clearly stolen the theft has been reported schumacher office will press for criminal charges and damages if the documents and data are made public kehm said schumacher manager sabine kehm warned media outlets that they face prosecution if they either buy or publish her client medical records which have been clearly stolen confirming the theft has been reported highlight several pages of michael schumacher medical notes have been stolen highlight prosecutors believe they are being made available to the media for highlight the leak has been traced to computer in swiss helicopter company highlight his manager has warned anyone buying the notes will be prosecuted ,several pages of michael schumacher medical notes have been stolen highlight prosecutors believe they are being made available to the media for highlight the leak has been traced to computer in swiss helicopter company highlight his manager has warned anyone buying the notes will be prosecuted , the year old has been in the of the year highlight the year old was found to the year of the year old highlight the year old was found to the of the year of the year highlight the year old has been in the of the year of the year
