,origReview,origSummary,predSummary
7,stadium will be transformed into green and pleasant land the green set will transform into bleak industrial landscape and performers will recreate the march of when men walked to london to protest poverty and unemployment in the north east there will also be tribute to the suffragette movement led by an actress portraying and celebration of of when west indians sailed to britain in search of new life played out to calypso soundtrack britain national health service will also be honoured by parade of real nurses pushing hospital beds around the arena performers will pay tribute to the beatles by dressing in outfits inspired by the sgt pepper album cover and there room in the show for tribute to the beatles as performers dressed in sgt pepper inspired military uniforms fill the inside of the stadium detailed soundtrack will accompany each performance changing as the history parade progresses to the present day including an all female urban dance group who ll perform the background music as group of bmx bikers recreate stunts one highlight is expected to be the appearance of five olympic rings which will converge and burst into flames in spectacular pyrotechnic display before sir paul mccartney closes the event with performance of hey jude there will be three final rehearsals for the opening ceremony in the olympic stadium the week before the games featuring up to people including schoolchildren the volunteer performers are not being paid but will receive travel and food costs and officials have sent out letters warning those taking part not to divulge any information about what they are doing such is the pressure to get the ceremony perfect that officials have warned that any children unable to make every practice session will be prevented from performing the opening ceremony which will be attended by inside stratford olympic stadium including the queen is due to begin at pm on july steve redgrave sydney redgrave becomes the greatest olympian of all time and claims th gold at consecutive olympics daley thompson los angeles sets decathlon world record wins gold and celebrates with back flip usain bolt beijing breaking world records in the and sprint double coe moscow took gold in the coe takes the kelly holmes athens holmes wins gold in and mark spitz munich winning seven swimming gold medals chris hoy beijing winning three gold medals in beijing michael johnson atlanta wins gold shatters the world record then takes the gold too derek redmond barcelona helped by his father redmond finished the race in tears after breaking down with injury cathy freeman sydney freeman dressed in full body suit wins gold in her home olympic compiled by sega for london the official video game of the olympic games highlight bn people expected to watch danny boyle million isles of wonder show honouring britain highlight sources reveal the show will include history march paying tribute to the nhs and suffragettes highlight it will also shine light on immigration poverty and unemployment in the th century ,bn people expected to watch danny million of wonder show britain highlight sources reveal the show will include history march paying tribute to the nhs and highlight it will also shine light on immigration poverty and unemployment in the th century , the year old has been in the of the year highlight the year old was found to the year of the year old highlight the year old was found to the of the year of the year highlight the year old has been in the of the year of the year
8,people with ebola and they basically pricked with needle during that treatment it possible there no virus in the needle the monitoring is precaution more than anything else the individual has been admitted to the the royal free hospital in london for monitoring he added on arrival in the uk the healthcare worker was transferred to the royal free hospital for assessment they will be monitored for any symptoms for the remainder of their incubation period in line with standard procedures both will pooley pauline cafferkey and the military health worker flown back to the uk were treated at the royal free hospital in an isolated ward to stop the spread of infection the public health england spokesperson said the health worker admitted today is not in an isolation unit they said when pauline cafferkey had ebola that when you go into isolation this person hasn been diagnosed with ebola it wouldn be the same level of risk so doubt it professor paul cosford phe director for health protection and medical director added the overall risk to the general public from ebola remains very low british nurses pauline cafferkey left and will pooley right were also treated at the royal free in specialist isolation unit to protect against the spread of the disease the individual is likely to have been exposed to the virus but has not been diagnosed with ebola and does not have symptoms pictured is the high secure infectious disease unit at the royal free hospital london we are confident all appropriate public health actions have been and will continue to be taken to support this individual and to protect the public health the courage shown by every volunteer in helping those affected in west africa and to prevent the spread of ebola any wider should be recognised as of the beginning of this month there have been total of cases of ebola confirmed and deaths since the outbreak began according to figures from the world health organization and the centers for disease control and protection the news comes after earlier this month an international team of scientists said it is very likely that the ebola virus will mutate to become an airborne virus making it infinitely more deadly they reviewed past studies examining past outbreaks of ebola within human populations as well as animal studies writing in the journal of the american society for microbiology the team noted research where healthy animals kept at distance from infected ones died from the virus however they acknowledged the primary form of transmission will be through contact with the bodily fluids of an ebola patient highlight uk health worker was pricked with needle and flown back to england highlight fifth british worker admitted to the royal free in london for monitoring highlight public health england stressed they have not been diagnosed with ebola highlight added they are not showing symptoms and are not in an isolation unit highlight british nurses will pooley and pauline cafferkey treated in same hospital ,uk health worker was with needle and flown back to england highlight fifth british worker admitted to the royal free in london for monitoring highlight public health england stressed they have not been diagnosed with ebola highlight added they are not showing symptoms and are not in an isolation unit highlight british nurses will pooley and pauline treated in same hospital , the year old has been in the of the year highlight the year old was found to the year of the year old highlight the year old was found to the of the year of the year highlight the year old has been in the of the year of the year
9,by chris parsons last updated at pm on th august shot supporters of jeremy hill say he was protecting his children when he shot the bear which had wandered on to his property file picture dozens of supporters have turned out in court to show their outrage after man was charged with killing grizzly bear which had wandered into his back yard where his children were playing jeremy hill has been charged with unlawfully taking federally protected species after allegedly shooting the bear when it ambled on to his rural home in idaho near the canadian border supporters of the father of six say mr hill was doing nothing more than protecting his children when the bear accompanied by two other bears wandered on to his property on may it is thought the bear was shot with bolt action rifle after approaching an enclosure where mr hill children had been raising pigs at hearing in the district court in coeur alene idaho the crowd was so big that the magistrate judge had to move the case to another courtroom jury trial has been set for oct if convicted hill could face penalties of up to one year in prison and fines up to following the hearing mr hill father mike hill told com this whole thing is waste of taxpayer money mr hill snr said at least five of his son six children were at home when the three bears approached his property support mr hill court hearing in coeur alene idaho was attended by so many people it had to be moved to different courtroom the endangered species act the grizzly bear as threatened species in the lower states and it is protected by federal law hill and his wife have six children and their home is between two federal grizzly bear recovery zones the selkirk zone to the west and cabinet zone to the east biologists estimate that grizzlies inhabit the zones that include parts of idaho british columbia and montana highlight jeremy hill killed bear with shotgun when it wandered on to his property ,jeremy hill killed bear with shotgun when it wandered on to his property , the year old has been in the of the year highlight the year old was found to the year of the year old highlight the year old was found to the of the year of the year highlight the year old has been in the of the year of the year
10,denied the allegations against her leaving miss blake who denies the allegations faces up to three years in jail if convicted source said they were completely drunk started kissing and then got carried away that when they started having sex when the police officer went over he found the woman was completely naked and they were having sex on the back seat after their arrest the pair were taken to the nearby ali police station and held in custody from may to may rebecca blake pictured and conor mcredmond were arrested after an all day drinking binge police took dna samples to provide evidence that they had had sex and had been drinking officers are waiting for the results to come back from the forensic laboratory before they send the pair to court they were released on bail only when two separate friends acted as and handed over their passports miss blake was bailed after surety was paid by company manager rowley rees brown friend who lives in dubai she claimed she had not been arrested on suspicion of having sex and insisted she had been alone in the back of the cab in an interview she is reported to have said have no idea where these sex allegations have come from because none were put to me by the authorities was arrested for having bottle of beer in the back of cab not having sex that is all was alone in the vehicle mr mcredmond who is thought to work for an engineering firm also denies the charges those convicted of having sex outside marriage face sentence of between one month and three years under dubai law consumption of alcohol is punishable by up to six months in jail and fine of up to foreigners jailed in dubai are deported immediately after completing their sentences strict islamic state briton rebecca black and irishman conor mcredmond are said to have engaged in drunken tryst after leaving bar in dubai foreigners jailed in dubai are deported immediately after completing their sentences the case highlights the difficulties faced by more than britons who live in dubai officials in the gulf state have prosecuted several britons for indecent behaviour over the past five years the case highlights the difficulties faced by more than britons who live in dubai officials in the gulf state have prosecuted several britons for indecent behaviour over the past five years in vince of bromley kent and michelle palmer of oakham rutland were given three month jail terms for having sex on beach they claimed they had simply been kissing and cuddling and the sentences were suspended on appeal in estate agent charlotte adams and ayman were jailed for one month by dubai court for kissing and fondling each other in restaurant breach of strict decency laws highlight recruitment consultant rebecca blake was told to clear her desk after being arrested in dubai highlight miss blake and irish welder conor mcredmond were detained for five days after drinking binge ,recruitment consultant rebecca blake was told to clear her desk after being arrested in dubai highlight miss blake and irish were detained for five days after drinking binge , the year old has been in the of the year highlight the year old was found to the year of the year old highlight the year old was found to the of the year of the year highlight the year old has been in the of the year of the year
11,the evening thousands more are expected to line up again today by am the queue was already one hour long forcing the cathedral to start admitting people into the viewing area during morning prayer gelato village an italian ice cream shop has also made special richard iii rose blossom and fruits of the forest flavoured ice cream move which yesterday prompted the business busiest day ever the leicester mercury souvenir supplement produced alongside the newspaper has already made it onto ebay bids on one post have already reached while customers also have the option to buy it now for meanwhile an order of service from sunday ceremony is also being sold on the auction site with current of alongside an official king richard iii traffic marshal pass badge which has an asking price of some of those in the queue had flown to leicester for the occasion from vancouver moscow and other parts of europe the king remains will stay under the watchful eye of an honour guard of ex forces veterans at leicester cathedral until thursday when the th century ruler will finally be lowered into purpose built tomb made of yorkshire stone the ceremony will be led by the archbishop of canterbury justin welby on friday more than flickering flames will illuminate the streets around leicester cathedral in commemoration of the reinterment the free event entitled leicester glows will see trail of the thousands of small flames being lit in small containers which will be placed on the ground to line routes in the area surrounding the cathedral the increased footfall in leicester since the discovery in expected to bring into the city coffers more than people queued outside the cathedral yesterday pictured while two hour long queue has already formed outside the building today the crook backed monarch the last english king to have died in battle was most famously depicted as the shakespearean hunchback in richard iii whose brief reign is marked by the allegation that he murdered his own nephews but the pivot for the change in public opinion which sparked huge debate over the whereabouts of his reinterment was in when the monarch bones were discovered beneath social services parking bay in central leicester when dna tests bone analysis and other scientific scrutiny established that the skeleton belonged to the king archaeologists revealed that he had been given hasty burial with grave so short the king head was propped up against its side visitors will be able to visit the coffin between am and pm today and then between pm and pm and pm and pm tomorrow viewing will take place between am and pm highlight thousands have flocked to see richard iii coffin in leicester cathedral highlight business are cashing in by selling items connected to king reinterment highlight visitor centre selling raft of goods including shirts pencils and tote bags highlight local is selling richard iii rose blossom flavoured ice cream highlight richard iii discovery and reburial expected to bring into leicester ,thousands have flocked to see richard iii coffin in leicester cathedral highlight business are in by selling items connected to king highlight visitor centre selling of goods including shirts and bags highlight local is selling richard iii rose ice cream highlight richard iii discovery and expected to bring into leicester , the year old has been in the of the year highlight the year old was found to the year of the year old highlight the year old was found to the of the year of the year highlight the year old has been in the of the year of the year
12,irwin mitchell said dishonesty in any legal proceedings should not be tolerated the family court should not be an exception this is yet another case in which an unfair settlement has been agreed because of one party being dishonest and not sharing all the details of their wealth to the courts we are pleased that the supreme court has agreed to hear this case alongside alison sharland battle mrs gohil will fight alongside alison sharland left who accepted from her ex husband charles right in the belief it was half his fortune his firm appsense was later valued wildly higher both cases raise serious issues about how the courts should handle cases where information shared with the court and used to agree divorce settlement is later found to be false or incomplete we believe the situation that both women find themselves in is unfair and that is why we applied for permission to take their cases to the supreme court in this case the court of appeal judges admitted having sympathy with mrs gohil situation in our view if family law judges who are given broad discretion to ensure fairness in proceedings are having to acknowledge this then something in the letter of the law has stopped that fairness from prevailing there are numerous legal arguments to be heard by the supreme court but we hope that ultimately justice will be done and will be seen to be done in the previous hearing lord justice mcfarlane offered mrs gohil his sympathy but said it was simply not open to the court to decide in about an issue discussed in the judge said that it was apparent that at some stage prior to the husband became involved in offences of fraud and money laundering on an astonishing scale mr gohil was an out and out rogue involved in financial criminality on an eye watering scale lord justice mcfarlane said landmark mrs gohil case will be heard alongside that of alison sharland at the supreme court pictured to the eyes of the wife and it seems the judge it was possible to discern at least the outlines of smoking gun indicating that the husband must have had substantial assets in and prior to which he failed to disclose in the financial relief proceedings but there was no evidence gohil had met before the middle of more than year after the payout was settled the judge added according to the judge the jailed ex husband said his wealth related only to period after mid and besides as they have been found to represent proceeds of crime they cannot be taken by his wife the case will be decided after supreme court hearing next june highlight gohil accepted and peugeot car from in highlight but six years later he was jailed for ten years for part in million con highlight he was acting as solicitor for corrupt nigerian governor james highlight now mrs gohil will be allowed to ask for more in supreme court ,accepted and car from in highlight but six years later he was jailed for ten years for part in million con highlight he was acting as solicitor for nigerian governor james highlight now mrs will be allowed to ask for more in supreme court , the year old has been in the of the year highlight the year old was found to the year of the year old highlight the year old was found to the of the year of the year highlight the year old has been in the of the year of the year
13,liverpool defender glen johnson looks certain to leave anfield when his contract expires this summer as he looks at clubs which he feels could help turn around his career johnson was late substitute in liverpool win over swansea city on monday night but is already looking for new club despite brendan rodgers attempts to keep hold of the england full back it seems likely that johnson will follow the example of fellow english full back ashley cole and opt for move abroad when his deal expires though there is chance he could stay in the barclays premier league is the right move comes up glen johnson right could be joining steven gerrard left out of liverpool exit door this summer brendan rodgers has said he wants johnson to stay but the year old is now looking at other clubs jonathan barnett johnson agent says his client is looking for somewhere where he can turn around his career indicating that the england right back does not see his long term future in merseyside he obviously looking for things at the moment he looking at many clubs barnett said glen is obviously looking for somewhere where he can turn around his career that the most important thing for him somewhere where he can play nicely under good club that challenging for things that is where he wants to be serie side roma had been touted as one potential destination in move that would see johnson reunited with former england team mate cole but barnett says the club from the italian capital are yet to get in touch johnson challenges edinson cavani during last summer world cup but he has struggled this season johnson is free to talk to overseas clubs with less than six months remaining on his liverpool contract johnson is free to talk to overseas clubs with less than six months remaining on his liverpool contract can really say if he is considering roma we ve had no contact with roma although rome would be lovely place for him barnett added speaking to ashley cole absolutely adores it there represent him as well ashley thinks very highly of rome but we ve had no contact with roma regarding glen johnson has played times for liverpool this season but has not started in the premier league since the defeat to manchester united on december ashley cole right moved to roma last summer and johnson could join him in what is lovely place highlight liverpool glen johnson is out of contract at anfield in the summer highlight he seems certain to leave as he looks to turn around his career highlight roma have been linked with the player but are yet to get in touch highlight johnson agent says rome would be lovely place for him highlight he was an th minute substitute in liverpool win over swansea city highlight click here for all the latest liverpool news ,liverpool glen johnson is out of contract at anfield in the summer highlight he seems certain to leave as he looks to turn around his career highlight roma have been linked with the player but are yet to get in touch highlight johnson agent says rome would be lovely place for him highlight he was an th minute substitute in liverpool win over swansea city highlight click here for all the latest liverpool news , the year old has been in the of the year highlight the year old was found to the year of the year old highlight the year old was found to the of the year of the year highlight the year old has been in the of the year of the year
